#CODE;ENGLISH;FRENCH;GERMAN;;SPANISH;;;;;;;;;x
build_erebor;A new Kingdom Under The Mountain;Le Royaume Sous La Montagne;;;;;;;;;;;;x
build_erebor_desc;Found the most powerfull a wealthy kingdom of the dwarves after Khazâd-dum.;Fondez le plus puissant et riche royaume des Nains après Khazâd-dum.;;;;;;;;;;;;x
EVTTITbuilding_erebor.0;A new Kingdom Under The Moutain.;Un nouveau Royaume Sous La Montagne. ;;;;;;;;;;;x
EVTDESCbuilding_erebor.0;You can now try to build and establish a new major dwarven kingdom under the Lonely Mountain, but it won't be easy.;Vous pouvez maintenant essayer de créer un nouveau royaume nain sous la Montagne Solitaire, mais cela ne sera pas chose aisée.;;;;;;;;;;;;x
EVTOPTAbuilding_erebor.0;Let's do it !;Faisons-le !;;;;;;;;;;;;x
EVTOPTBbuilding_erebor.0;No, I'm not ready.;Non, je ne suis pas prêt.;;;;;;;;;;;;x
EVTTITbuilding_erebor.1;Orc Raid;Pillards Orcs;;;;;;;;;;;;x
EVTDESCbuilding_erebor.1;On the way to the Lonely Mountain, an unemployed mercenary company tells you about a camp of orc raiders ahead. The orcs are a larger group than yours, but there is no way to pass undetected. The mercenaries propose you to hire them...;Sur le trajet vers la Montagne Solitaire, une compagnie de mercenaires vous prévient qu'il y-a un campement de pillards orcs devant vous. C'est un groupe plus important que le votre, mais il est impossible de les dépasser sans se faire repérer. Les mercenaires vous proposent leurs services.;;;;;;;;;;;;x  
EVTOPTAbuilding_erebor.1;Hire the mercenaries and watch.;Enrôler les mercenaires et regarder.;;;;;;;;;;;;x
EVTOPTBbuilding_erebor.1;Fight without the mercenaries;Combattre sans les mercenaires.;;;;;;;;;;;;x
EVTOPTCbuilding_erebor.1;Hire the mercenaries and lead the fight;Enrôler les mercenaires et combattre.;;;;;;;;;;;;x
EVTOPTDbuilding_erebor.1; We cannot win this battle. We leave now !;Nous ne pouvons pas gagner alors partons !;;;;;;;;;;;;x
EVTTITbuilding_erebor.2;Defeat...;Défaite...;;;;;;;;;;;;x
EVTDESCbuilding_erebor.2;The Orcs won the day, your troops are scatered and in too few numbers. There is nothing to be done except leaving the place... alive if possible.;Les orcs ont gagné cette fois. Vos troupes sont dipersées et en trop petit nombre. Il n'y à rien à faire à part quitter les lieux... en essayant de rester en vie.;;;;;;;;;;;x
EVTOPTAbuilding_erebor.2;Retreat !!!;Retraite !;;;;;;;;;;;x
EVTTITbuilding_erebor.3;Collapse;Effondrement;;;;;;;;;;;;x
EVTDESCbuilding_erebor.3;The digging caused a major collapse in the galleries. If you want to go deeper, you'll first have to consolidate what's already existing. It will take time and money for additional materials...;Des galleries se sont effondrées de façon importante, si vous souhaitez creuser plus loin, vous devrez d'abord consolider les galleries déja existantes... Cela prendra du temps et de l'argent pour des matériaux supplémentaires.;;;;;;;;;;;;x
EVTOPTAbuilding_erebor.3;Reinforce the ceiling and the walls ! I'll watch from here.;Renforcez les galleries, je supervise tout cela !;;;;;;;;;;;x
EVTOPTBbuilding_erebor.3;No more funds, only our arms !;Plus d'argent, juste la force de nos bras!;;;;;;;;;;x
EVTOPTCbuilding_erebor.3;Pay for additional beams. I go help the men !;Ajoutons des poutres et je vais aider les mineurs.;;;;;;;;;;;x
EVTOPTDbuilding_erebor.3;No, I'm exhausted.;Je suis épuisé…;;;;;;;;;;;;x
EVTTITbuilding_erebor.4;Collapse;Effondrement;;;;;;;;;;;;x
EVTDESCbuilding_erebor.4;The collapse could not be stopped. Most of the galleries are lost, and you've failed to save the diggers. After honoring them, you decide to leave the depth of Erebor to the Mountain itself;L'effondrement n'a pas pu être arrêté et la majorité des galleries sont perdues, ainsi que les sapeurs qui s'y trouvaient. Après avoir honoré leur mémoire, vous décider de laisser les entrailles d'Erebor à la montagne elle-même.;;;;;;;;;;;;x
EVTOPTAbuilding_erebor.4;I'll come back.;Je reviendrais.;;;;;;;;;;;;x
EVTTITbuilding_erebor.5;Magma;Magma;;;;;;;;;;;;x
EVTDESCbuilding_erebor.5;You came too far and too deep and encountered a minor magmatic chamber. It could very well mean the end for this new kingdom it the lava comes up. There are water drains above that can be derivated to stop the main lava flow but some miners got trapped and need some help. Losing time could prevent from stopping the lava... What do you decide ?;Vous avez creusé trop loin et trop profondément et avez rencontré une petite poche de magma. Cela pourrait très bien signifier la fin de ce nouveau royaume si la lave remonte. Des canalisations d'eau sont un peu plus haut et peuvent être utilisés pour bloquer le principal torrent de lave. Cependant un groupe de mineurs s'est retrouvé pris au piège et a besoin d'aide... mais chaque minute perdue pourrait rendre le torrent de lave inarrêtable... Que décidez-vous ?;;;;;;;;;;;;x
EVTOPTAbuilding_erebor.5;Use the water against the main lava flow !;Utilisez l'eau contre l'écoulement de lave principal !;;;;;;;;;;;x
EVTOPTBbuilding_erebor.5;Save the miners first, the lava will wait !;Sauvez les mineurs d'abord, la lave attendra !;;;;;;;;;;;x
EVTOPTCbuilding_erebor.5;Split the water in two !;Séparez l'eau en deux écoulements !;;;;;;;;;;;x
EVTOPTDbuilding_erebor.5;This place is too dangerous, we leave now !;;;;;;;;;;;;x
EVTTITbuilding_erebor.6;Magma;Magma;;;;;;;;;;;;x
EVTDESCbuilding_erebor.6;You failed to fill the gallerie leading to the magmatic chamber, and now lava is rising. The only thing you can do is leave this place with as many living dwarves as possible.;Vous avez échoué à boucher la gallerie menant à la oche de magma, et maintenant la lave remonte. tout ce qu'il vous reste à faire est de quitter les lieux avec autant de nains vivants qu'il est encore possible.;;;;;;;;;;;x
EVTOPTAbuilding_erebor.6;I'll come back.;Je reviendrais.;;;;;;;;;;;;x
EVTTITbuilding_erebor.7;A new kingdom !;Un nouveau royaume !;;;;;;;;;;;;x
EVTDESCbuilding_erebor.7;You managed to dig and build a major home for dwarves. Something that will last forever and that could challenge the glory of Khazâd-dum itself !;Vous avez réussi à creuser assez profond et à bâtir un nouveau foyer pour le peuple Nain. Quelquechose qui perdurera et qui pourrait bien rivaliser avec Khazâd-dum !;;;;;;;;;;;;x
EVTOPTAbuilding_erebor.7;Great !;Parfait !;;;;;;;;;;;;x
EVTTITbuilding_erebor.8;The treasures of Erebor;;;;;;;;;;;;x
EVTDESCbuilding_erebor.8;As you visit one of the newest and deepest galleries, something cath your eye in a crack. You come closer and recognize the shining light of a gem. You order to dig further in this direction and soon many other gems are found.;Alors que vous visitez une des plus récentes et profondes gallerie, vous remarquez quelquechose de brillant dans une fissure. Vous vous approchez et reconnaissez l'éclat d'une pierre précieuse. Vous ordonnez alors de creuser davantage dans cette zone et bientôt, un gisement complet est mis à jour.;;;;;;;;;;;;x
EVTOPTAbuilding_erebor.8;The treasures of the moutains are now mine !;Les richesses de la montagne sont maintenant à moi!;;;;;;;;;;;;x
