#CODE;ENGLISH;FRENCH;GERMAN;SPANISH;x
EVTpalantir_use.1;The Seeing Stones;Utiliser le Palantír?;;;;;x
EVTDESCpalantir_use.1;You are the holder of one of the Palantíri, the Seeing Stones. Only a strong spirit is able to use them without being corrupted by Sauron, but war is coming. Will you look into the Palantír and see what perils may be awaiting you?;Vous possédez l'une des Pierres de Visions, les Palantír. Seul un esprit fort sera capable de l'utiliser, mais les rumeurs de la guerre arrivent jusqu'à vous. Voulez-vous regarder dans le Palantír malgré tout les dangers?;;;;;x
EVTOPTApalantir_use.1;Yes, it is my right!;Oui, c'est mon droit !;;;;;x
EVTOPTBpalantir_use.1;No, it's too dangerous...;Non, il y a trop de risques.;;;;;x
EVTpalantir_use.2;Using the Stone;Vous Utilisez le Palantír;;;;;x
EVTDESCpalantir_use.2;You are in your secret room, and the Palantír sits on it's pedestal in front of you. Slowly, you put your hand upon it, and look deep into the Stone...;Vous êtes dans votre haute Tour, faisant face au Palantír. Lentement, vous vous approchez de la pierre, posez votre main dessus, et commencez à regarder…;;;;;x
EVTOPTApalantir_use.2;I... see something...;Je vois quelquechose …;;;;;x
EVTpalantir_use.3;Great Visions;Vous voyez le Monde !;;;;;x
EVTDESCpalantir_use.3;Slowly, forms appear in the Stone, dancing and changing. Little by little, you see different parts of the world appear within the stone, you can see the lands of your enemies, and their plans against you appear more clearly...;Lentement, des formes apparaissents dans la pierre, et petit à petit, vous finissez par voir des parties proches et éloignées du monde. Les complots contre vous semblent plus clairs…;;;;;x
EVTOPTApalantir_use.3;I can understand all the mechanisms of this world!;Je peux comprendre les rouages de ce Monde !;;;;;x
EVTpalantir_use.4;Deathly Visions;Vous voyez la Mort !;;;;;x
EVTDESCpalantir_use.4;Slowly, forms appear in the Stone, dancing and changing. Little by little, you see dark lands appear, destruction, war, fire and death!;Lentement, des formes apparaissents dans la pierre, et petit à petit, vous finissez par voir des parties proches et éloignées du monde. Mais vous ne voyez que mort et désolation …;;;;;x
EVTOPTApalantir_use.4;There is no hope!;Il n'y a plus d'espoir !;;;;;x
EVTOPTApalantir_use.;I can understand all the mechanisms of the World!;Je peux comprendre les rouages de ce Monde !;;;;;x
EVTpalantir_use.5;Visions of War;Vous voyez la Guerre !;;;;;x
EVTDESCpalantir_use.5;Slowly, forms appear in the Stone, dancing and changing. Little by little, you see dark lands appear, destruction, war and a huge army marching against your realm!;Lentement, des formes apparaissents dans la pierre, et petit à petit, vous finissez par voir des parties proches et éloignées du monde. De nombreuses armées apparaissent, mais pas sous votre commandement…;;;;;x
EVTOPTApalantir_use.5;We must flee!;Je devrais m'enfuir…;;;;;x
EVTpalantir_use.6;Terrible Visions;Vous voyez l'Œil !;;;;;x
EVTDESCpalantir_use.6;Slowly, forms appear in the Stone, dancing and changing. Little by little, you see different parts of the world appear within the stone. Suddenly, everything disappears, and there is only a Great Eye, looking right at you!;Lentement, des formes apparaissents dans la pierre, et petit à petit, vous finissez par voir des parties proches et éloignées du monde. Soudain, tout s'arrête, et il ne reste plus qu'un Grand Œil, qui vous fixe …;;;;;x
EVTOPTApalantir_use.6;No! I can't resist!;Non! Je ne peux pas résister !;;;;;x
EVTpalantir_use.7;Using the Palantír?;Utiliser le Palantír?;;;;;x
EVTDESCpalantir_use.7;You have already looked into the Palantír once... and it was so fascinating! In your dreams, you are looking again, and again. You are becoming obsessed. Can you resist it's powers of temptation?;Vous avez déjà regardé dans le Palantír, et c'était … si fascinant… Dans vos rêves, vous vous voyez regarder encore et encore, découvrir le monde entier. C'est devenu une véritable obsession… Allez-vous y résister?;;;;;x
EVTOPTApalantir_use.7;I want to see... I must see again!;Je veux regarder … encore!;;;;;x
EVTOPTBpalantir_use.7;I must control myself...;Non, je dois me controler.;;;;;x
obsessed_by_Palantír;Obsessed by Palantír;Obsédé par le Palantír;;;;;x
obsessed_by_Palantír_desc;You have already looked several times into the Palantír. You are obsessed by it, and you can't resist looking at it. Every day, again and again, your court pity you and your family weep.;;;;;;x
EVTpalantir_use.8;Palantír Obsession;Utiliser le Palantír?;;;;;x
EVTDESCpalantir_use.8;You've already looked several times into the Palantír. You are now obsessed by it, and you can't resist looking into it again and again... One of your courtiers is trying to help you, and has told you to stop this madness!;Vous avez déjà regardé dans le Palantír de nombreuses fois, et vous êtes devenu totalement obsédé par la Pierre. Vous n'arrivez plus à résister, et devez toujours plus regarder… Un de vos conseillers essaie de vous aider, et de vous faire renoncer à cette folie !;;;;;x
EVTOPTApalantir_use.8;It is my Stone! Mine!;Je regarderais MA Pierre !;;;;;x
EVTOPTBpalantir_use.8;Maybe... I should stop...;Peut-être… devrais-je arrêter?;;;;;x
EVTpalantir_use.9;A Hidden Stone;Enfermer le Palantír ?;;;;;x
EVTDESCpalantir_use.9;You know that looking into the Palantír again is asking for madness. Will you make the right choice, and hide the Palantír somewhere, never to speak of or use it again?;Vous comprenez maintenant que regarde encore dans le Palantír vous rendra fou. Ferez-vous le bon choix, et enfermerez-vous cette Pierre dans un lieu où vous ne l'utiliserez plus?;;;;;x
EVTOPTApalantir_use.9;Yes. It is time to free my mind.;Oui. Il est temps de libérer mon esprit.;;;;;x
EVTOPTBpalantir_use.9;It is my right to use it, no one can take it from me!;C'EST MON DROIT DE L'UTILISER !;;;;;x
EVTDESCpalantir.0;You are the protector of the Tower of Amon Sûl, and as such, you need to guard the Stone of Amon Sûl, one of the seven palantíri brought to Middle-earth by Elendil and the survivors of Numenor.;Vous êtes le protecteur de la Tour d'Amon Sûl, et en tant que tel, vous devez garder la Pierre d'Amon Sûl, l'un des sept Palantiri amenés en Terre-du-Milieu par Elendil et les survivants de Numenor.;;;;;x
EVTOPTApalantir.0;My House will guard this Stone.;Ma Maison protégera cette Pierre.;;;;;x
EVTDESCpalantir.1;You are the protector of the Tower of Elostirion, and as such, you need to guard the Elendil-Stone, one of the seven palantíri brought to Middle-earth by Elendil and the survivors of Numenor.;Vous êtes le protecteur de la Tour d'Elostirion, et en tant que tel, vous devez garder la Pierre d'Elendil, l'un des sept Palantiri amenés en Terre-du-Milieu par Elendil et les survivants de Numenor.;;;;;x
EVTOPTApalantir.1;My House will guard this Stone.;Ma Maison protégera cette Pierre.;;;;;x
EVTDESCpalantir.2;You are the protector of the City of Minas Anor, and as such, you need to guard the Anor-Stone, one of the seven palantíri brought to Middle-earth by Elendil and the survivors of Numenor.;Vous êtes le protecteur de la Cité de Minas Anor, et en tant que tel, vous devez garder la Pierre d'Anor, l'un des sept Palantiri amenés en Terre-du-Milieu par Elendil et les survivants de Numenor.;;;;;x
EVTOPTApalantir.2;My House will guard this Stone.;Ma Maison protégera cette Pierre.;;;;;x
EVTDESCpalantir.3;You are the protector of the City of Minas Ithil, and as such, you need to guard the Ithil-Stone, one of the seven palantíri brought to Middle-earth by Elendil and the survivors of Numenor.;Vous êtes le protecteur de la Cité de Minas Ithil, et en tant que tel, vous devez garder la Pierre d'Ithil, l'un des sept Palantiri amenés en Terre-du-Milieu par Elendil et les survivants de Numenor.;;;;;x
EVTOPTApalantir.3;My House will guard this Stone.;Ma Maison protégera cette Pierre.;;;;;x
EVTDESCpalantir.4;You are the protector of the Tower of Orthanc, and as such, you need to guard the Orthanc-Stone, one of the seven palantíri brought to Middle-earth by Elendil and the survivors of Numenor.;Vous êtes le protecteur de la Tour d'Orthanc, et en tant que tel, vous devez garder la Pierre d'Orthanc, l'un des sept Palantiri amenés en Terre-du-Milieu par Elendil et les survivants de Numenor.;;;;;x
EVTOPTApalantir.4;My House will guard this Stone.;Ma Maison protégera cette Pierre.;;;;;x
EVTDESCpalantir.5;You are the protector of the Dome of the Stars, and as such, you need to guard the Osgiliath-Stone, one of the seven palantíri brought to Middle-earth by Elendil and the survivors of Numenor.;Vous êtes le protecteur du Dôme des Etoiles, et en tant que tel, vous devez garder la Pierre d'Osgiliath, l'un des sept Palantiri amenés en Terre-du-Milieu par Elendil et les survivants de Numenor.;;;;;x
EVTOPTApalantir.5;My House will guard this Stone.;Ma Maison protégera cette Pierre.;;;;;x
EVTDESCpalantir.6;You are the protector of the Tower of Amon Sûl, and as such, you need to guard the Amon Sûl-Stone, one of the seven palantíri brought to Middle-earth by Elendil and the survivors of Numenor.;Vous êtes le protecteur de la Tour d'Amon Sûl, et en tant que tel, vous devez garder la Pierre d'Amon Sûl, l'un des sept Palantiri amenés en Terre-du-Milieu par Elendil et les survivants de Numenor.;;;;;x
EVTOPTApalantir.6;My House will guard this Stone.;Ma Maison protégera cette Pierre.;;;;;x
EVTDESCpalantir.7;You know that the Elendil-Stone isn't connected to the others Palantiri of Middle-Earth, but is linked to the Master-Stone, located in the Tower of Avallonë, in Tol Eressëa. You can go on pilgrimage, and try to look into the stone, to try to see the Undying Lands.;Vous savez que la pierre d'Elendil n'est pas reliée aux autres Palantir de la Terre du Milieu, mais est liée à la Pierre-Maitre, située dans la Tour d'Avallonë, à Tol Eressëa. Vous pouvez partir en pélerinage, et essayer de regarder dans la pierre, pour tenter d'apercevoir les Terres Immortelles.;;;;;x
EVTOPTApalantir.7;I want to see the Undying Lands.;Je veux tenter d'apercevoir les Terres Immortelles.;;;;;x
EVTOPTBpalantir.7;The Link is broken…;Le Lien est brisé…;;;;;x
EVTDESCpalantir.8;A company came in your court, and asked permission to look to the Elendil-Stone. You're the Guardian of this Palantir, so it's up to you to decide if visitors can access it ... or not.;Une compagnie est arrivée dans votre cour, et demande l'autorisation de regarder dans la Pierre d'Elendil. Vous en êtes le Gardien, c'est donc à vous de décider si des visiteurs peuvent y avoir accès... ou non.;;;;;x
EVTOPTApalantir.8;You can try to look at it.;Vous pouvez tenter de regarder.;;;;;x
EVTOPTBpalantir.8;The Stone is locked.;La Pierre est enfermée.;;;;;x
EVTDESCpalantir.9;You've entered the Tower, and you're in front of a pedestal surmounted by the Elendil-Stone. The crystal sphere is completely black, and doesn't seem to return any reflection. Will you dare to put your hands on the Palantir, to try to see the Undying Lands?;Vous êtes entré dans la Tour, et vous vous retrouvez face à un piédestal, surmonté par la Pierre d'Elendil. La sphère de cristal est entièrement noire, et ne semble renvoyer aucun reflet. Allez-vous oser poser vos mains sur le Palantir, pour tenter de voir les Terres Immortelles?;;;;;x
EVTOPTApalantir.9;I'll try to see the Undying Lands.;Je vais tenter d'apercevoir les Terres Immortelles.;;;;;x
EVTOPTBpalantir.9;I just wanted to see the Stone.;Je voulais juste voir la Pierre.;;;;;x
EVTDESCpalantir.10;The Guardian of the Elendil-Stone denied to you the access to the Tower, saying that, under his protection, the Palantir can be seen by visitors. You've come a long way for nothing, and now, it's time for you to come back to home.;Le Gardien de la Pierre d'Elendil vous a refusé l'accès à la Tour, vous disant que sous sa protection le Palantir ne peut être vu par les visiteurs. Vous avez fait un long chemin pour rien, et vous ne pouvez plus que rentrer.;;;;;x
EVTOPTApalantir.10;An unnecessary travel ...;Un voyage inutile…;;;;;x
EVTDESCpalantir.11;You looked in the Palantir, but you haven't seen anything. It seems that the link between the Undying Lands and Middle Earth is broken, after all ...;Vous avez regardé dans le Palantir, mais vous n'avez rien pu voir. Il semble que le lien entre les Terres Immortelles et la Terre du Milieu soit brisé, après tout...;;;;;x
EVTOPTApalantir.11;At least, I saw the Stone…;Au moins, j'ai vu la Pierre…;;;;;x
EVTDESCpalantir.12;You look in the Stone of Elendil, and after several minutes with nothing happening, you start to see some movements in the lines of the crystal. A white light appears for a few seconds, then disappears … You can't see anything now…;Vous regardez dans la Pierre d'Elendil, et après de longues minutes sans que rien ne se passe, vous commencez à voir des mouvements dans les lignes du cristal. Une lumière blanche apparait pendant quelques secondes, puis disparait… Vous ne voyez plus rien maintenant...;;;;;x
EVTOPTApalantir.12;At least, I saw something!;Au moins, j'ai vu quelquechose !;;;;;x
EVTDESCpalantir.13;You look in the Stone of Elendil, and after several minutes and nothing happens, you start to see movement in the lines of the crystal. A white light appears for a few seconds, then disappears ... Finally, it's replaced by the vision of a Great White Tower, with a white city and a major port. In the port, many swan-ships...;Vous regardez dans la Pierre d'Elendil, et après de longues minutes sans que rien ne se passe, vous commencez à voir des mouvements dans les lignes du cristal. Une lumière blanche apparait pendant quelques secondes, puis disparait... Enfin, elle est remplacée par la vision d'une Grande Tour Blanche, avec en contrebas une ville et un grand port. Dans le port, de nombreux navires en forme de cygnes semblent attendre de prendre la Mer...;;;;;x
EVTOPTApalantir.13;This is Tol Eressëa !;C'est Tol Eressëa !;;;;;x
EVTTITpalantir.14;The Anor-Stone;La Pierre d'Anor;;;;;x
EVTDESCpalantir.14;You're the Lord of Minas Tirith, formerly named Minas Anor, but the Palantir that was in this city left the walls, carried out by one of his Guardian. You should ask the current Guardian of the Anor-Stone to bring the palantir to where it should be.;Vous êtes le Seigneur de Minas Tirith, anciennement nommée Minas Anor, mais le Palantir qui se trouvait dans cette cité a quitté les murs, emporté par l'un de ses gardiens. Vous devriez demander à son gardien actuel de rapporter la pierre à l'endroit où elle doit reposer.;;;;;x
EVTOPTApalantir.14;I'll claim the Palantir.;Je réclame le Palantir.;;;;;x
EVTOPTBpalantir.14;It's not that important.;Ce n'est pas si grave.;;;;;x
EVTTITpalantir.15;The Anor-Stone;La Pierre d'Anor;;;;;x
EVTDESCpalantir.15;You're the Guardian of the Anor-Stone, but you're not in Minas Tirith, where the Palantir should be. The current lord of the city of Gondor sent you a letter, asking you to return the stone to its rightful location. What will you answer him?;Vous êtes le Gardien de la Pierre d'Anor, mais vous ne vous trouvez pas à Minas Tirith, où le Palantir devrait se trouver. L'actuel seigneur de la cité du Gondor vous a envoyé une missive, vous demandant de ramener la pierre à son emplacement légitime, sous sa garde. Qu'allez-vous lui répondre?;;;;;x
EVTOPTApalantir.15;This is a legitimate request.;C'est une demande légitime;;;;;x
EVTOPTBpalantir.15;I'm the rightful guardian of the Stone.;Je suis le Gardien Légitime de cette Pierre.;;;;;x
EVTTITpalantir.16;The Anor-Stone;La Pierre d'Anor;;;;;x
EVTDESCpalantir.16;The Guardian of the Anor-Stone has accepted your request and the Palantir returned to the city. As Lords of Minas Tirith, you and your heirs now become the guardians and will have to protect the stone, whatever the cost.;Le Gardien de la Pierre a accepté votre demande, et le Palantir est revenu dans la cité. En tant que Seigneur de Minas Tirith, vous et vos héritiers en devenez maintenant le gardien, et devrez protéger la pierre quoiqu'il en coûte.;;;;;x
EVTOPTApalantir.16;The Anor-Stone is back in the city.;La Pierre d'Anor est de retour dans la cité.;;;;;x
EVTTITpalantir.17;The Anor-Stone;La Pierre d'Anor;;;;;x
EVTDESCpalantir.17;The Guardian of the Anot-Stone has denied your claim, arguing that he's the legitimate protector of the Palantir. The Stone doesn't return to Minas Tirith, for now ...;Le Gardien de la Pierre a rejeté votre demande, arguant qu'il est le protecteur légitime du Palantir. La Pierre ne revient donc pas à Minas Tirith, pour le moment...;;;;;x
EVTOPTApalantir.17;I'll remember this…;Je m'en souviendrais…;;;;;x
EVTTITpalantir.18;The Palantir;Le Palantir;;;;;x
EVTDESCpalantir.18;The Palantir is still kept outside the walls of the city, despite your request. You may find a way to take the stone so that it can regain its original location. What do you say?;Le Palantir est encore gardé en dehors des murs de la cité, malgré votre demande. Vous devriez peut-être trouver un stratagème pour reprendre cette pierre, afin qu'elle puisse retrouver son emplacement originel. Qu'en dites-vous?;;;;;x
EVTOPTApalantir.18;We'll stole it!;Nous la volerons !;;;;;x
EVTOPTBpalantir.18;We don't want a fight…;Nous ne voulons pas de combats…;;;;;x
EVTTITpalantir.19;Raiders in the Dark…;Des Voleurs dans le Noir…;;;;;x
EVTDESCpalantir.19;You've gathered some of your best scouts, giving them a delicate mission. They must find the Palantir, and bring it back to the City. They swapped their official uniforms for discrete clothes and are now waiting to your order to go ahead ...;;;;;;x
EVTOPTApalantir.19;Seize only the Palantir!;Emparez-vous seulement du Palantir !;;;;;x
EVTOPTBpalantir.19;Steal the Stone and kill his guardian!;Volez la Pierre et tuez son Gardien!;;;;;x
EVTOPTCpalantir.19;We don't want a fight…;Nous ne voulons pas de combats…;;;;;x
EVTTITpalantir.20;An Attack in the Night;Une Attaque dans la Nuit;;;;;x
EVTDESCpalantir.20;While you were going to get some rest after a long day, you heared some noises in the hallways of your home. You take your sword, and you quickly notice that black-weared men are heading towards the room where's kept the Palantir.;Alors que vous vous apprêtez à aller vous reposer après une longue journée, vous entendez des bruits dans les couloirs de votre demeure. Vous prenez votre épée, et vous remarquez que des hommes en noir se dirigent vers la salle où est gardé le Palantir.;;;;;x
EVTOPTApalantir.20;I'll defend the Palantir !;Je vais défendre le Palantir !;;;;;x
EVTTITpalantir.21;Sucess!;Réussite de la Mission!;;;;;x
EVTDESCpalantir.21;Your men returned victorious, bringing with them the coveted Palantir. You can now congratulate them as they should be, and most importantly, put the Stone of Vision on his original base.;Vos hommes sont revenus, victorieux, rapportant avec eux le Palantir tant convoité. Vous pouvez maintenant les féliciter comme il se doit, et surtout, placer la pierre de vision sur son socle originel.;;;;;x
EVTOPTApalantir.21;Finally, the Stone came back.;Enfin, le Palantir est de retour.;;;;;x
EVTTITpalantir.22;Loss of a Palantir…;Perte d'un Palantir…;;;;;x
EVTDESCpalantir.22;Despite your efforts, you haven't managed to prevent thieves from taking the stone. You can imagine, however, that the sponsor of this robbery is none other than the one who claimed the stone a few days ago...;Malgré vos efforts, vous n'avez pas réussi à empêcher les voleurs de prendre la pierre. Vous vous doutez cependant que le commanditaire de ce rapine n'est autre que celui qui a réclamé la pierre il y a quelques jours...;;;;;x
EVTOPTApalantir.22;Damn…;Malédiction…;;;;;x
EVTTITpalantir.23;Fail of the Mission…;Echec de la Mission…;;;;;x
EVTDESCpalantir.23;Despite your best men, the Guardian of the Palantir, aided by his personal guard, was able to protect the room where the stone is stored. Some of your men returned, while others were killed or captured ...;Malgré vos meilleurs hommes, le gardien du palantir, aidé de sa garde personnelle, a réussi à protéger la salle où est stockée la pierre. Une partie de vos hommes sont rentrés, tandis que d'autres ont été tués ou capturés...;;;;;x
EVTOPTApalantir.23;Damn…;Malédiction…;;;;;x
EVTTITpalantir.24;A Good Defender;Un Bon défenseur;;;;;x
EVTDESCpalantir.24;You managed to protect the room that keeps the palantir. Some Survivors of the robbers fled in the night, while the bodies of those you've defeated are lying on the ground.;Vous avez réussi à protéger la salle qui garde le palantir. Les voleurs survivants se sont enfuis dans la nuit, tandis que les corps de ceux que vous avez vaincu gisent sur le sol.;;;;;x
EVTOPTApalantir.24;I'm a True Guardian.;Je suis un véritable Gardien.;;;;;x
EVTTITpalantir.25;Sucess!;Réussite de la Mission!;;;;;x
EVTDESCpalantir.25;Your men returned from mission, the Palantir in their luggage. During the stealing, they also killed the former protector of the stone, which had dared to deny your legitimate request.;Vos hommes sont revenus de mission, le Palantir dans leurs bagages. Durant le vol, ils ont également tués l'ancien protecteur de la pierre, qui avait osé refuser votre légitime demande. ;;;;;x
EVTOPTApalantir.25;"A Good lesson for this ""Guardian"".";"Une Bonne leçon pour ce ""Gardien"".";;;;;x
EVTTITpalantir.26;Defeat!;Défaite !;;;;;x
EVTDESCpalantir.26;Despite a heroic defense, you've been defeated by the thieves in front of the doors of the room that contained the palantir. You're seriously injured, and while you catch your breath difficulty, you see the men in black leave with the precious stone ... All is lost.;Malgré une défense héroïque, vous avez été défait par les voleurs, devant les portes de la salle qui renfermait le palantir. Vous êtes gravement blessé, et pendant que vous reprenez votre souffle difficilement, vous voyez les hommes en noir repartir avec la précieuse pierre... Tout est perdu.;;;;;x
EVTOPTApalantir.26;I… am… dying…;Je… meurs…;;;;;x
EVTTITpalantir.27;Raiders in the Dark…;Des Voleurs dans le Noir…;;;;;x
EVTDESCpalantir.27;You've gathered some of your best scouts, giving them a delicate mission. They must find the Palantir of Minas Tirith, kill the actual guardian, and bring it back to the City. They swapped their official uniforms for discrete clothes and are now waiting to your order to go ahead ...;;;;;;x
EVTOPTApalantir.27;Kill this fool!;Tuez cet idiot !;;;;;x
EVTTITpalantir.28;The Ithil-Stone;La Pierre d'Ithil;;;;;x
EVTDESCpalantir.28;You're the Lord of Minas Ithil, but the Palantir that was in this city left the walls, carried out by one of his Guardian. You should ask the current Guardian of the Ithil-Stone to bring the palantir to where it should be.;Vous êtes le Seigneur de Minas Ithil, mais le Palantir qui se trouvait dans cette cité a quitté les murs, emporté par l'un de ses gardiens. Vous devriez demander à son gardien actuel de rapporter la pierre à l'endroit où elle doit reposer.;;;;;x
EVTOPTApalantir.28;I'll claim the Palantir.;Je réclame le Palantir.;;;;;x
EVTOPTBpalantir.28;It's not that important.;Ce n'est pas si grave.;;;;;x
EVTTITpalantir.29;The Ithil-Stone;La Pierre d'Ithil;;;;;x
EVTDESCpalantir.29;You're the Guardian of the Ithil-Stone, but you're not in Minas Ithil, where the Palantir should be. The current lord of the city of Gondor sent you a letter, asking you to return the stone to its rightful location. What will you answer him?;Vous êtes le Gardien de la Pierre d'Ithil, mais vous ne vous trouvez pas à Minas Ithil, où le Palantir devrait se trouver. L'actuel seigneur de la cité du Gondor vous a envoyé une missive, vous demandant de ramener la pierre à son emplacement légitime, sous sa garde. Qu'allez-vous lui répondre?;;;;;x
EVTOPTApalantir.29;This is a legitimate request.;C'est une demande légitime;;;;;x
EVTOPTBpalantir.29;I'm the rightful guardian of the Stone.;Je suis le Gardien Légitime de cette Pierre.;;;;;x
EVTTITpalantir.30;The Ithil-Stone;La Pierre d'Ithil;;;;;x
EVTDESCpalantir.30;The Guardian of the Ithil-Stone has accepted your request and the Palantir returned to the city. As Lords of Minas Ithil, you and your heirs now become the guardians and will have to protect the stone, whatever the cost.;Le Gardien de la Pierre a accepté votre demande, et le Palantir est revenu dans la cité. En tant que Seigneur de Minas Ithil, vous et vos héritiers en devenez maintenant le gardien, et devrez protéger la pierre quoiqu'il en coûte.;;;;;x
EVTOPTApalantir.30;The Ithil-Stone is back in the city.;La Pierre d'Ithil est de retour dans la cité.;;;;;x
EVTTITpalantir.31;The Ithil-Stone;La Pierre d'Ithil;;;;;x
EVTDESCpalantir.31;The Guardian of the Ithil-Stone has denied your claim, arguing that he's the legitimate protector of the Palantir. The Stone doesn't return to Minas Ithil, for now ...;Le Gardien de la Pierre a rejeté votre demande, arguant qu'il est le protecteur légitime du Palantir. La Pierre ne revient donc pas à Minas Ithil, pour le moment...;;;;;x
EVTOPTApalantir.31;I'll remember this…;Je m'en souviendrais…;;;;;x
EVTTITpalantir.32;The Osgiliath-Stone;La Pierre dOsgiliath;;;;;x
EVTDESCpalantir.32;You're the Lord of Osgiliath, but the Palantir that was in this city left the walls, carried out by one of his Guardian. You should ask the current Guardian of the Osgiliath-Stone to bring the palantir to where it should be.;Vous êtes le Seigneur d'Osgiliath, mais le Palantir qui se trouvait dans cette cité a quitté les murs, emporté par l'un de ses gardiens. Vous devriez demander à son gardien actuel de rapporter la pierre à l'endroit où elle doit reposer.;;;;;x
